凤凰房产,houseifeng,http://www.iwgc.cn/list/4862,'你好,感谢关注!我们是凤凰房产,中国高端物业首席导购平台.专注于互联网房地产行业高端项目导购,时刻提供优质购房指南、行业新闻、海外视野、精彩图片等.欢迎访问:house.ifeng.com'
几米漫画,jimimanhua,http://www.iwgc.cn/list/5629,'治愈系漫画平台,世界之大,能和你相遇就是美好的开始,愿我用漫画和文字温暖你.'
百思不得姐,bsbdjie,http://www.iwgc.cn/list/130,'别人笑姐太疯癫,姐笑他人看不穿!'
约会大师NEY,yhds22,http://www.iwgc.cn/list/1991,'专注解决中国男性社交障碍,提供专业约会技能,保证能让你约得到妹子,谈心仪的恋爱,让对你没兴趣的人对你有兴趣,让喜欢你的人更喜欢你.想追上心中女神吗?想屌丝逆袭白富美吗?关注我们-魅力生活从此开始!'
玩车教授,gzwcjs,http://www.iwgc.cn/list/4477,'专业汽车新媒体,专注汽车导购教你如何买车,超过五百万车友关注!24小时提供在线购车咨询.'
品途商业评论,pintu360,http://www.iwgc.cn/list/2448,'品途商业评论——发现商业创新,专注于商业企业互联网化变革.'
国浩律师事务所,grandall,http://www.iwgc.cn/list/3309,'传播法治理念、解读政策法规、研讨律师实务、分析典型案例、透视财经信息、发布国浩动态.'
环球旅行者,ovpRRR,http://www.iwgc.cn/list/116,'环球旅行者,穿越了100多个国家,走过了1000都个城市,只为带给你最美的风景,世界那么大,和我一起旅行吧'
广发分享日,GDB-sharing-day,http://www.iwgc.cn/list/8660,'广发信用卡各类给力优惠资讯!'
虎扑体育,HUPUtiyu,http://www.iwgc.cn/list/4565,'虎扑体育——中国最大的专业体育网站,中国体育营销的领军者.'
狂言NBA,tx_nba,http://www.iwgc.cn/list/5715,'最劲爆,最热辣,最癫狂的NBA资讯评论,尽在狂言NBA!'
4399手机游戏网,sj4399,http://www.iwgc.cn/list/2596,'4399手机游戏网(www.4399.cn)是一家可信赖的手机游戏媒体,依托4399小游戏的品牌优势迅速成长为国内最专业的手机游戏媒体之一.专注推荐最新最酷的手机游戏.集安卓、苹果游戏分发,手游资讯、攻略、社区为一...'
永州发布,yongzhoufabu,http://www.iwgc.cn/list/7190,'传递政务信息,提供服务资讯.“永州发布”期待您的关注,共话“幸福永州”.'
地产一条,paidichan,http://www.iwgc.cn/list/3429,'中国最佳地产原创新媒体,每天一条,值得信赖.'
插坐学院,chazuomba,http://www.iwgc.cn/list/390,'也许是国内最好的企业新媒体学习与分享平台,面向500万企业新媒体负责人提供在线讲座与线下课程,每天推送鲜活、实用的干货案例.'
医学界外科频道,yxj-wk,http://www.iwgc.cn/list/1641,'医学界外科频道,面向全国的外科医生提供最权威的学术资讯、专家采访、典型病例等.'
中国政府网,zhengfu,http://www.iwgc.cn/list/1074,'中国政府网由国务院办公厅主办,第一时间权威发布国务院重大决策部署和重要政策文件、国务院领导同志重要会议活动等政务信息.'
杭州农行信用卡,hangzhounhjsk,http://www.iwgc.cn/list/8620,'杭州农行信用卡中心官方平台.各类杭州农行信用卡优惠资讯,随时随地,触手可及.现在起,您即可轻松发现杭州精彩生活!'
假杂志,jiazazhi,http://www.iwgc.cn/list/7510,'假杂志是一个摄影出版机构,致力于摄影作品在纸上呈现的种种可能.我们的实践包括网络自媒体、出版计划、发行计划、同名季刊.'
FUN来了,shfun021,http://www.iwgc.cn/list/2192,'凤凰新闻客户端[FUN来了]栏目,搜罗好玩新闻、吐槽大事小事、集合囧图段子.欢迎投稿.'
金融投资报,jrtzb028,http://www.iwgc.cn/list/8485,'财经新闻、证券快讯、投资理财、艺术财经、私募基金等资讯平台.'
囧哥说事,jionggeshuoshi,http://www.iwgc.cn/list/1951,'比233更有含金量的轻松新闻,来自[新浪新闻客户端].'
一带一路,YDYL2015,http://www.iwgc.cn/list/1604,'提供最新国家经济政策资讯,一手行业信息;;对外贸易资讯,境外贸易咨询;;中国海上丝绸之路信息之载体'
医学界骨科频道,yxj-guke,http://www.iwgc.cn/list/7497,'欢迎关注“医学界骨科频道”,我们将为您提供最新、最热的学科资讯.'
装修情报,myhousing,http://www.iwgc.cn/list/39,'分享前人经验、欣赏精美案例、实用知识精选,最实用、最专业的装修媒体!'
有趣点,youquD,http://www.iwgc.cn/list/2017,'有趣只需一点,最有趣的手游媒体.'
Beta财富管理,BetaWM,http://www.iwgc.cn/list/7298,'面向读者:金融业精英及管理层.关注财富管理行业发展趋势与动态,海量筛选最有价值的行业信息,涵盖银行零售、券商经纪、信托财富、基金渠道、第三方理财等领域,报道金融机构“出来卖的”那点事!(“出来卖”指...'
新媒体指数,mediaindex,http://www.iwgc.cn/list/4328,'研究分析全球社交媒体数据,主要基于各大媒体平台开展关系与价值指数评估.网址:www.gsdata.cn.'
国防科大,gfkdbst,http://www.iwgc.cn/list/5913,'欢迎访问中国人民解放军国防科学技术大学官方微信公众号!'
中国疾控动态,zgjkdt,http://www.iwgc.cn/list/1947,'是中国疾病预防控制中心的官方账号,向公众传播健康知识,发布疾病预防信息和公布突发疫情等.'
科技正能量,pp_tech,http://www.iwgc.cn/list/8038,'相信文字有力量改变世界,坚持科技改变生活的正面角度,希望科技内容回归促进社会进步的本质,我们是真正的科技正能量内容平台!'
看赏,Ebookread,http://www.iwgc.cn/list/8144,'好故事,新见识.@博集新媒'
小果哥哥,xiaoguogege123,http://www.iwgc.cn/list/4927,'小果哥哥,在我这可以收获快乐!关注小果将带你走上人生巅峰!么么哒~'
生物谷,BIOONNEWS,http://www.iwgc.cn/list/1058,'生物医药行业的中文媒介平台和专业服务提供商.依托互联网,面向医药生物行业企业、研发机构、高校、园区以及政府等,提供咨询调研,行业分析,品牌包装,产品推广,人力资源,会议策划,医学科研服务等全方位的服...'
Socialmouths,Socialmouths,http://www.iwgc.cn/list/3000,''
电商在线,ec_online,http://www.iwgc.cn/list/5176,'电商在线,全方位服务电商的综合性平台全新亮相,最及时电商资讯,最深度淘宝解读,最全面营销案例,最专业营销工具,致力于服务全网电商成长.'
彩色斑马,colourfulzebra,http://www.iwgc.cn/list/7203,'如果斑马没有斑,你觉得它会是白马还是黑马?一定非黑即白吗?有没有可能是彩色马?每个孩子的底色都是彩色的,而教育的本质是发现、关爱、陪伴和滋养.这是一个关注儿童心智成长与潜能发展的公众号,致力于给孩子...'
武汉万达电影乐园,wandamoviepark,http://www.iwgc.cn/list/8219,'武汉万达电影乐园总建筑面积10万平方米,是万达集团斥巨资在楚河汉街西端建造的全球唯一的室内电影主题乐园.拥有飞越湖北、星际旅行、极速飙车、终极能量、西游斗魔和自然威力六大主题区,希望以尖端电影科技,带...'
万达德贡汉秀,thehanshow,http://www.iwgc.cn/list/8218,'汉秀官方微信,提供“演出”“ 票务”“ 购票”信息!'
梦想行动家,DreamFarmer,http://www.iwgc.cn/list/538,'梦想行动家(DAF)是一个帮助人找到梦想,实现梦想的组织,成立于2013年3月. 梦想行动家注重目标力与行动力,通过线下行动和线上平台以及梦想基金,帮助会员一步步找到自己想要的人生梦想,并与伙伴一起实现.'
江苏商报,jssb01,http://www.iwgc.cn/list/8476,'《江苏商报》是江苏省唯一的经济生活类日报,是为城市年轻人度身打造的新概念媒体.瞄准中小企业,提供贴心服务.'
FWMA,FashionWeMedia,http://www.iwgc.cn/list/7563,'中国时尚自媒体联盟,精准覆盖百万主流时尚人群,旨在为优秀的时尚行业自媒体人搭建新的平台,加强自媒体和商业资源的深度融合.为热爱时尚的人群打造从服饰、美容、设计、艺术到生活的全领域资讯和个性化服务.'
中关村创业大街,zgccydj,http://www.iwgc.cn/list/2889,'中关村创业大街,是海淀置业与清控科创旗下的创新服务平台.位于中关村西区的核心位置,是创新服务集聚区、科技企业发源地、创业者文化圣地.'
健康中国,jkzg-nhfpc,http://www.iwgc.cn/list/7362,'卫生与计划生育信息发布'
跟老狼学摄影,laolang-pcw,http://www.iwgc.cn/list/6907,'你好,非常高兴你的加入,成为我们的一员.这是一个摄影交流平台,每天我们会尽力为你推送精彩的文章.在这里已经汇聚了很多影友 ,希望能有更多机会与大家一起玩摄影,一起去旅行.如想看更多精彩文章请加入我们的...'
逗唠坊,dlf566,http://www.iwgc.cn/list/4826,'逗唠坊,逗你开心,陪你唠嗑!'
西班牙生活通,SHTSPAIN,http://www.iwgc.cn/list/2406,'1.提供西班牙购物优惠和消费折扣的独家信息及吃喝玩乐、衣食住行等生活类资讯.2.介绍西班牙投资移民、置业贸易、留学旅游、法律保险等各类信息.3.介绍中国驻西使馆的各类涉侨事务及国内政府对华侨、华裔、留学生...'
环球旅讯,Traveldaily,http://www.iwgc.cn/list/5627,'影响行业的力量'
高质量生活知识,gzlshzs,http://www.iwgc.cn/list/1573,'每天一次,只发高质量的,让你做个品味出众的人!合作联系QQ:89302680'
政商阅读,zsyd86,http://www.iwgc.cn/list/4921,'公司治理和金融专家,主要致力于公司监管、项目融资、直接投资、企业重组、兼并与收购、破产等方面的研究.'
陈列共和,chenliegonghe,http://www.iwgc.cn/list/2051,'陈列共和, 商业、生活美学杂志; 美学规律教育领跑者; 五感体验设计先行者.'
香港百事通,ixianggan,http://www.iwgc.cn/list/2658,'香港旅游百事通,告诉你香港的吃喝玩乐!'
中国教育报,Zhongguojiaoyubao,http://www.iwgc.cn/list/2848,'《中国教育报》是教育部主办的以教育新闻为主的全国性日报,是中国最具权威和最有影响力的国家级教育新闻媒体.教师自己的报纸,学生喜爱的报纸,教育部门离不开的报纸.'
学点说话技巧,MTshuohua,http://www.iwgc.cn/list/1559,'越是有故事和阅历的人;表现越是简单和沉静:而自夸和滔滔不绝的人则更多的是肤浅浅薄;浮躁不安.'
浦东发布,pdnews,http://www.iwgc.cn/list/2802,'关注我们,多一个小布这样的政府里工作的朋友,告诉你浦东每天大政小事、低调内涵的人物故事还有好吃好玩的地方…更酷的是,我们上班时间都在线,直接对话,为你有效解决和政府有关的问题.'
心之助,luyuexinli,http://www.iwgc.cn/list/2202,'为大家解答各种情感、婚姻、亲子关系、人际关系、职场困惑、个人成长各种疑难杂症的一个平台.'
商业周刊中文版,businessweek,http://www.iwgc.cn/list/178,'《商业周刊/中文版》由美国彭博社、中国商务部、现代传播集团联合出版,定位于“国际视野,全球商机”,以洞见和趣味服务于全球化新经济时代读者.'
工作清单,golist,http://www.iwgc.cn/list/1081,'工作清单'
跑步者说,runnersaid,http://www.iwgc.cn/list/3364,'发起100天跑步养成计划“百人百天”的自媒体平台,跑步者说,让坚持跑步不再难!'
经理人杂志,sino-manager,http://www.iwgc.cn/list/2307,'来自腾讯微博认证资料:经理人杂志官方微博 @经理人杂志'
中国青年报,Chinaqnb,http://www.iwgc.cn/list/2291,'历史的一份底稿.'
DOIT,doitimer,http://www.iwgc.cn/list/7980,'中国领先的科技新媒体,关注科技与数据经济,洞察IT走向DT.'
北大新媒体,beidaxinmeiti,http://www.iwgc.cn/list/6459,'北京大学创意产业研究中心新媒体研究室官方微信.为大家奉献新媒体相关的最新资讯、评论和研究.'
中国法律评论,chinalawreview,http://www.iwgc.cn/list/513,'一本有态度、有力度、有温度的法律专业期刊'
欧美内参,zoujinoumei,http://www.iwgc.cn/list/1796,'《欧美内参》唯一号,国内首个全面解读欧美社会的微媒体,辐射范围遍布全球130多个国家,深刻、独到、精致、有料.犀牛财经联盟发起人之一,蓝鲸财经记者联盟、北平财经公社资深成员.“有一种鸟儿是永远关不住的...'
财新网,caixinwang,http://www.iwgc.cn/list/507,'实时、原创、专业的财经新闻集散地.在信息爆炸的年代,你需要选择'
通信商情,txsq_2013,http://www.iwgc.cn/list/2795,'手机、配件、周边、智能硬件;行业、企业、产品、品牌,有的是信息,更有的是商机!联系我们:0755-83747997'
医学界临床药学频道,yxj_lcyx,http://www.iwgc.cn/list/1640,'面向全国的医生和药剂师,提供实用的用药指南、国内外学术进展、最新学术前沿、基础教育等内容,每日优质内容等你关注.'
胡润百富,hnb444,http://www.iwgc.cn/list/3267,'胡润百富旗下拥有杂志《胡润百富》月刊、《名校指南》、《胡润马道》、《擎》四本杂志和胡润研究院以及一个专门为中国企业家和高收入人士进行商务活动策划的部门.《胡润百富》杂志目标读者为中国富有的精英人士....'
放射沙龙,shenzhenclear,http://www.iwgc.cn/list/1609,'放射沙龙将为您带来最新放射学术动态、专家动态、学术会议预告、经典病例、医生职场感悟等资讯.放射沙龙——数万放射科医生都在关注的微信平台.'
创富志,cfz83499098,http://www.iwgc.cn/list/1092,'创富志——商业模式整体解决方案提供商.首创商业模式第一刊.首个关于商业模式的创始人俱乐部.8年专注,1000多个原创商业模式案例积累,200多位高价值创始人会员.致力于构建商业模式生态进化圈.欢迎您的加入!'
广东发布,gdfabu0710,http://www.iwgc.cn/list/6427,'深化改革当先锋.欢迎关注广东省人民政府新闻办公室官方微信,共建共享幸福广东.'
财经主张,tttmoney9,http://www.iwgc.cn/list/1987,'谈论一切跟投资有关的话题,为您的投资指点迷津'
首都教育,bjedunews,http://www.iwgc.cn/list/6717,'发布首都教育权威资讯,解读教育政策,提供教育信息服务.'
硬派健身,oh-hard,http://www.iwgc.cn/list/15,'最专业 · 蠢萌 · 靠谱的运动健身科普'
医学界肿瘤频道,yxj-zl,http://www.iwgc.cn/list/717,'“医学界肿瘤频道“每日发送优质资讯,内容学术进展、学科资讯、实用指南、病例讨论等内容.'
微新广汉,newgh777,http://www.iwgc.cn/list/4094,'微新广汉由广汉市委、市政府主办,广汉市新闻传媒中心负责发布管理.第一时间发布广汉新闻资讯、政务服务、人文广汉等信息.'
PUA,pua_up,http://www.iwgc.cn/list/5106,'PUA(Pick-up Artists,搭讪艺术家),我们作为专业的PUA团队,通过总结多年把妹经验,向您提供精彩的PUA理论,技巧和实战指导.为您发现并解决各种情感问题,提供专属咨询服务,定制属于您个人的情感生活.'
有方空间,youfang502,http://www.iwgc.cn/list/1109,'呈现今日中国建筑现场'
第一财经资讯,yicainews,http://www.iwgc.cn/list/1802,'第一财经为您提供有价值的资讯和有价值观的评论.'
意林,yilinzazhi,http://www.iwgc.cn/list/2137,'来自腾讯微博认证资料:《意林》杂志官方微博 @意林杂志'
二十一世纪商业评论,weixin21cbr,http://www.iwgc.cn/list/724,'《二十一世纪商业评论》敏感于一切商业新知、商业产品、商业模式和商业英雄,敏感于新公司的新玩意、老公司的新改造、旧话题的新表达、老商业的新颠覆,为您提供最新鲜实用的商业养分.'
易观国际,yiguanguoji,http://www.iwgc.cn/list/8118,'用数据解读互联网化,用实力找到你的“互联网+”.易观国际专注互联网15年,超过500家长期合作客户,为1200多家国内外客户提供电商咨询, 3800多家中文媒体引用易观的互联网研究成果.拥抱互联网,从易观开始!'
布谷TIME,bgtime,http://www.iwgc.cn/list/8336,'聪明你的投资!'
猫眼科技,maoyantc,http://www.iwgc.cn/list/6004,'我只关注地球上的歪、黑科技、边缘科学、疯狂技术、未来商品,还有一群被称为创客的“疯子”.你们地球人的科技树已被点歪!猫哥负责带你涨姿势...'
壹读,yiduiread,http://www.iwgc.cn/list/87,'日常生活中的百科、文艺背后的历史,热点深处的冷知识.用轻幽默、有情趣的方式一起涨姿势、正三观.'
宅腐社,zhaifu666,http://www.iwgc.cn/list/5613,'北京中微互娱文化传播有限公司'
兴业银行福州分行,cibfzfh,http://www.iwgc.cn/list/8724,'介绍金融资讯,推介理财产品、服务及相关活动.'
教你修福报,zhihuifayu,http://www.iwgc.cn/list/5293,'福祸无门,惟人自召,善恶报应,如影随行,世间的名闻利养可能是福,也可能是祸,【教你修福报】与您分享最全面的福报修行法门,感悟“命由我造,福自己求”,以正确的方式去种大福报,积大功德,圆满人生.'
中国银行广东分行,bocgdxyk,http://www.iwgc.cn/list/8772,'发布广东地区中行信用卡刷卡优惠、有奖游戏、业务预约、金融资讯和生活服务类资讯,以及本地特色业务服务.'
威锋网,weixinweifengwang,http://www.iwgc.cn/list/1213,'威锋网官方微信号'
乱码,luanma4,http://www.iwgc.cn/list/5900,'这是一张充满冷知识、狂吐槽、雄性激素以及古怪趣味的日报,除了屌,好像也没什么优点了.'
国科环宇,UCAS2004,http://www.iwgc.cn/list/5346,'国科环宇——军工领域最受欢迎的公众平台!'
杂家Misc,zajia163,http://www.iwgc.cn/list/7456,'网易原创栏目《杂家Misc》.关注杂家,重新解读你的生活日常.'
中国连锁经营协会,CCFA2013,http://www.iwgc.cn/list/4729,'中国连锁经营协会于1997年在民政部注册成立,是连锁经营领域唯一的全国性行业组织;目前,拥有企业会员1000余家,连锁店铺20万个,包括本土和跨国零售商、特许加盟企业、供应商等.'
音乐人网,classicalmusician,http://www.iwgc.cn/list/896,'关注音乐人网,每日实用技巧,助你默默成长.'
贵州交通广播,gzfm952,http://www.iwgc.cn/list/506,'欢迎收听阳光952贵州交通广播,直播热线96952'
财经记者圈,caiji007,http://www.iwgc.cn/list/7598,'财经记者圈(caiji007)︱聚焦财经动态,洞悉财媒变迁,关注财记业务,关心财记生活,覆盖新闻学界知名学者、教授,全国主流财经媒体高层、主编、记者编辑及金融人士等.财经记者圈,聚顶尖财记!周末精华版专号caiji...'
后浪,zuimeiqh,http://www.iwgc.cn/list/1840,'后浪出版公司官方微信'
安卓网,Hiapk2013,http://www.iwgc.cn/list/2172,'我是彻底的Android拜物者.爱安卓,故我存在.'
相约新会,xinhuinews,http://www.iwgc.cn/list/6786,'以品牌宣传、公益服务为主要功能,提前发布当日《新会新闻》的精选内容.'
车友汇,MyCars,http://www.iwgc.cn/list/4924,'车友汇,面向爱车的你,带给你最新鲜的新车资讯,最真诚的选车指导,当然还有有趣的汽车生活.'
秒针系统,miaozhensystems,http://www.iwgc.cn/list/5453,'<!--red_beg-->秒针系统<!--red_end-->是中国领先的第三方广告技术公司,致力于为媒介投资者和行业提供中立、公正、科学、可靠的数据和有效的技术应用方案,推动广告行业的创新与发展.'
锐普PPT,rapidppt,http://www.iwgc.cn/list/64,'中国最火爆的PPT交流社区,打造行业最全PPT模板基地,倾力分享专业PPT设计作品及原创干货教程,最新演示设计潮流风向标!'
东方早报,dongfangdaily,http://www.iwgc.cn/list/7172,'图文阅读,视觉盛宴'
库博,cueball147,http://www.iwgc.cn/list/3058,'我们是深圳一家技术研发型公司,能干的不多,就专注于移动互联网这一片儿了,我们很乐意用新鲜的技术,好玩的创意,靠谱的应用,不错的人品,让客户感受到移动互联网的价值和魅力!'
互联网创业圈,cooboys,http://www.iwgc.cn/list/8191,'提供:创业、企业管理、职场 的精选文章;新媒体营销、研发管理、产品创新管理 培训咨询.'
腾讯房产,housesz,http://www.iwgc.cn/list/4865,''
港股那点事,hkstocks,http://www.iwgc.cn/list/835,'格隆汇旗下公众号.分享和探讨港股、美国中概股以及少量估值确有吸引力之A股的投资线索、投资机会与投资心得.'
黑白先生,heibaixiansheng333,http://www.iwgc.cn/list/4666,'据说在国内是最有思想的一个公众号,没有之一.'
上海发布,shanghaifabu,http://www.iwgc.cn/list/1164,'生活在这座梦幻的城市,与TA共同成长.我们提供上海的资讯,更希望成为您又一个喜欢上海的理由.这里是上海市人民政府新闻办微信平台.'
汽车人生,qiche8818,http://www.iwgc.cn/list/48,'您好,请点击最下方“关注”二字,以后就可以每天免费收到一次所有人都在找的精彩文章汇编!记住,是完全免费的,请放心关注!'
复旦讲座,fdulecture,http://www.iwgc.cn/list/1646,'复旦讲座,分享复旦及其他院校最新活动信息,每晚9点,睡前一文.'
中国保险报,zgbxbwx,http://www.iwgc.cn/list/4882,'《中国保险报》创刊于1994年1月5日,是一份以保险为特色的高端专业财经媒体,也是中国保险业唯一公开发行的报纸,入选2014年中央出版转型示范单位.现由中国保险监督管理委员会主管、中国保险报业股份有限公司主...'
艾媒咨询,iiMediaResearch,http://www.iwgc.cn/list/5464,'全球领先的移动互联网第三方数据挖掘和整合营销机构'
侨外移民,zhejiangqiaowai,http://www.iwgc.cn/list/3425,'侨外集团成立于1999年,总部设在首都北京.经过十多年的发展,侨外集团已经帮助成千上万个家庭及个人完成移民海外、出国留学的梦想,成为享誉国内出国移民行业的知名品牌.'
财联社晚间内参,cailianpresswanbao,http://www.iwgc.cn/list/4340,'《财联社晚间内参》系财联社旗下重要产品,主要向机构和私募投资者提供重要财经信息,深度报告.财联社(CaiLianPress.com):金融资讯服务商.'
87870虚拟现实,VR87870,http://www.iwgc.cn/list/8226,'87870网站是Oculus rift、虚拟现实技术、虚拟现实游戏、虚拟现实眼镜等虚拟现实内容的第一门户网站,拥有国内最专业的Oculus riftVR虚拟现实设备社区、最新的虚拟现实游戏资源下载等.'
深度网,szshendu,http://www.iwgc.cn/list/7890,'深度网最新案例展示,营销型网站建设,网站运营推广小知识.'
毕马威KPMG,KPMGChina,http://www.iwgc.cn/list/5557,'毕马威是由专业成员所组成的网络.成员所遍布全球155个国家,专业人员超过162;000名,提供审计、税务和咨询等专业服务.'
冷兔,lengtoo,http://www.iwgc.cn/list/12,'没错,我就是那个你知道的如假包换的冷兔!爱生活,爱讲冷笑话~ 每日游走于各大社交平台分享各种精彩热门搞笑内容~ 想看冷笑话?关注我一个就够了!'
人民网财经,finance_people,http://www.iwgc.cn/list/4262,'风声雨声读书声,声声入耳;家事国事天下事,事事关心.'
创业天府,tfinnovation,http://www.iwgc.cn/list/4806,'这里是天府新区创新创业官方平台. 这里会介绍成都天府新区、成都科学城的情况,还有天府新区的创新创业政策等, 也提供创新创业相关咨询. 来天府新区,和志同道合的小伙伴一起创新创业吧!'
萍乡交警直属大队,qq306080519,http://www.iwgc.cn/list/6532,'江西省萍乡市区道路交通安全宣传'
健康报,jkb1931,http://www.iwgc.cn/list/4908,'《健康报》是国家卫生和计划生育委员会主管的全国性卫生行业报,是1931年创建于江西瑞金红色根据地的第一份卫生专业报.专注于为各级卫生行政管理人员、广大医药卫生工作者及人民大众提供专业、权威、科学的卫生、...'
爱燃烧,iranshao,http://www.iwgc.cn/list/2765,'爱燃烧是最专业的中文跑步运动社区,为跑步爱好者提供更好的运动体验.'
繁荣成长工作坊,FlourishingParty,http://www.iwgc.cn/list/6326,'用科学的积极心理学,做更好更繁荣的自己'
HR商学院,hrshangxueyuan,http://www.iwgc.cn/list/2344,'HR商学院倡导一种全新的人力资源服务理念,为人力资源行业打造出一流的HR经理人.自09年创办以来平台已拥有近110万的注册学员,我们每天推送HR最关心的薪酬管理、员工培训、绩效考核、经典案例、行业资讯等,矢...'
人民日报评论,rmrbpl,http://www.iwgc.cn/list/819,'人民日报评论部微信公共账号.秉承党报评论的厚土,我们向新媒体平台伸出小小一枝,期待与您一起见证复杂而深刻的转型中国.'
法语世界,mimifr,http://www.iwgc.cn/list/3328,'学习法语语言和文化,关注法语世界动态.'
军报记者,jfjbdzzy,http://www.iwgc.cn/list/5914,'解放军报法人微信:瞭望军事风云,关注国家安全.'
腾讯游戏频道,txgames,http://www.iwgc.cn/list/2814,'特权礼包、福利活动、新游动态尽在腾讯游戏频道.'
绵阳微社区,mywsq0816,http://www.iwgc.cn/list/6482,'Just follow us!'
中商情报网,askci_com,http://www.iwgc.cn/list/4324,'融宏观财经、金融资讯、产业信息、创业资本于一体的综合财经信息门户 合作电话:0755-25950386'
印象笔记,yxbj100,http://www.iwgc.cn/list/197,'印象笔记,世界上最好的笔记应用,是全球 1 亿人的工作空间.所有手机、电脑和平板都能用.关注我们,效率更高,记忆更好.客观地说:爱用印象笔记的人,90% 都是聪明人,剩下 10% 是更聪明的人.'
