北京大学,iPKU1898,http://www.iwgc.cn/list/2162,'发布北大权威信息,展示北大校园生活,服务广大师生校友.'
建行烟台分行,ytccbcc,http://www.iwgc.cn/list/8836,'烟台建行信用卡中心'
建行邯郸分行,hd_ccb,http://www.iwgc.cn/list/8816,'关注中国建设银行邯郸分行官方平台,了解最新资讯,我们致力于为建行邯郸分行广大客户提供更多服务.24小时客户服务电话95533'
有故事的蒋同学,meiya54264,http://www.iwgc.cn/list/9182,'想在你平淡无奇的生活里捣捣乱'
建设银行柳州分行,ccb_liuzhou,http://www.iwgc.cn/list/8813,'建行品牌宣传,发布公告信息、营销活动信息,理财产品、优惠信息,电子银行产品等.'
TG实习狗,TGinternship,http://www.iwgc.cn/list/9183,'每日发布最新鲜的实习信息,推荐最有价值的深度好文.做最具先锋意识最有态度的实习伙伴,Guide you to be Talent.'
建行丽水分行,jhlsfhdzyh,http://www.iwgc.cn/list/8808,'关注建行丽水分行电子银行,即时收取建行电子银行业务信息.'
建行盐城分行,jsycccb,http://www.iwgc.cn/list/8809,'公众金融知识普及、企业公益形象宣传、金融安全宣传、企业及个人金融产品推介'
建行惠州市分行,jianhanghuizhou,http://www.iwgc.cn/list/8807,'建设银行惠州市分行官方平台.建行24小时客户服务热线:95533;建行信用卡中心24小时服务热线:400-820-0588.'
好姑娘光芒万丈,goodgoodgirls,http://www.iwgc.cn/list/8933,'这里有一台光芒售卖机,免费,自取.'
北京银行电子银行,gh_8aea34d94b64,http://www.iwgc.cn/list/9030,'关注北京银行电子银行,获取您最感兴趣的产品资讯、活动信息.'
猎豹移动,cmcm-hr,http://www.iwgc.cn/list/8928,'猎豹移动官方帐号,获取一手资讯.'
招商银行郑州分行,CMB-ZZ,http://www.iwgc.cn/list/9028,'豫小招用绳命保证:活动优惠不止,生活便利不断,财智干货不停!反正,好多机智的小伙伴都偷偷关注了!'
安居客,Anjuke-changsha,http://www.iwgc.cn/list/8930,'我是安居客,专注为你实现家的梦想.在这里,为你的一切房事负责,买房卖房租房就上安居客!'
招商银行银川分行,CMBYINCHUAN,http://www.iwgc.cn/list/9027,'用于发布招行卡刷卡有礼活动、特惠商户优惠信息、客户活动邀请信息、团购和客户体验优惠信息、刷卡消费常识、电子银行产品介绍等招商银行产品的相关信息.小招在线回复:工作日16:00—17:30.'
阳光巨化,ygjh1958,http://www.iwgc.cn/list/8923,'巨化集团公司官方认证微信平台 阳光巨化 伴您同行'
中国银行黑龙江分行,hljbocebank,http://www.iwgc.cn/list/8776,'中国银行黑龙江省分行信息发布、服务介绍以及营销活动推广等'
招商银行信用卡芜湖,cmbcard-wh,http://www.iwgc.cn/list/9024,'欢迎关注,周三五折美食日、加油返现、天天五折观影、五折欢唱,在线预约办理,众多区域精彩活动资讯'
招商银行烟台分行,zsyhytfh,http://www.iwgc.cn/list/9026,'用于介绍我行优质产品和与合作方开展的多项优惠活动的告知.'
能源圈,yinglifbs,http://www.iwgc.cn/list/8925,'2015年,从订阅者数量上,“能源圈”公号已经稳坐能源自媒体第一梯队.这得益于“能源圈”分享了对您胃口的新鲜独到的资讯、原创的分析与观点、独家制作的更多原创排行榜.当然了,2016年,“能源圈”最重要的任...'
招商银行信用卡-武汉,cmbchina_027,http://www.iwgc.cn/list/9023,'欢迎关注招商银行信用卡武汉卡部微信! 电影、餐饮、积分时时查! 办卡、分期、购车有妙招! 助您随时掌握武汉地区信用卡优惠活动!'
招行台州分行,cmbtz0576,http://www.iwgc.cn/list/9029,'做您优质的生活管家!'
房多多,fangddsz,http://www.iwgc.cn/list/8931,'房多多官方账号.我不是中介,我是房多多——房产直买直卖网!'
花花酱,dululu531,http://www.iwgc.cn/list/8935,'欢迎光临寒舍~'
小北叨逼叨,kuwoyiluxiangbei,http://www.iwgc.cn/list/8920,'主打夜晚情感类电台阅读栏目平台,收罗各种电台好声音好节目好文章,一档全新的以电台、阅读为主的声音社区.'
华夏银行杭州分行,hxhzgzpt,http://www.iwgc.cn/list/8892,'品牌宣传'
建行邢台分行,ccb-xt,http://www.iwgc.cn/list/8841,'关注中国建设银行邢台分行官方平台,了解最新产品资讯.我们致力于为建行邢台分行的广大客户提供更多金融服务,24小时客户服务电话95533,信用卡中心24小时服务电话4008200588.'
兴业银行日照支行,xyyhrz,http://www.iwgc.cn/list/8729,'兴业银行日照支行'
建设银行温州分行,gh_66de301122fb,http://www.iwgc.cn/list/8853,'中国建设银行股份有限公司温州分行 建行网站:www.ccb.com 建行客户服务热线:95533 建行信用卡中心客户服务热线:400-820-0588'
华夏银行股份有限公司长春分行,cchxbank,http://www.iwgc.cn/list/8891,'华夏银行长春分行官方微信'
华南师大石牌校区学生会,scnu_stuu,http://www.iwgc.cn/list/4001,'向同学们推送最新学校资讯,解答同学们的问题.'
机械工程师,MechanicalEngineers,http://www.iwgc.cn/list/8922,'每天推送一期图文消息,内容包含行业资讯、机械发展史、专业知识、工程师职业发展、机械产品结构和工艺欣赏等内容,绝对是【机械工程师】必须知道和关心的内容. 我们的目标:成为【机械工程师】的职业伴侣,构筑【...'
魔鬼心理学,xinlibb,http://www.iwgc.cn/list/8917,'超叫座、超神奇、超实用的心理学!没有哪比这更魔鬼!在这里,鬼鬼带着你解开爱情、沟通、工作中的层层疑惑!好玩的心理测试、心理技巧、心理学探秘等着你!'
建行山东分行,gh_9c67b5227c65,http://www.iwgc.cn/list/8849,'中国建设银行山东分行官方微信'
晏涛,yantao-219,http://www.iwgc.cn/list/7701,'新媒体和移动互联网营销的资深研究者和实践者,微营销实战教练,多家网站杂志专栏作者,培训指导过的企业下到个体户,上到全球500强,被称为“非著名”新营销实战专家,勤思考讲真话,凭良心混饭吃.关注我可获得...'
天使口碑,tskb2015,http://www.iwgc.cn/list/1603,'帮助创业者提高融资效率、降低融资成本.'
花旗银行信用卡,CitiCard,http://www.iwgc.cn/list/2747,'现在,享誉全球200年的花旗,在中国率先发行第一张国际银行信用卡,你会随时随地被人一眼认出,一路乐享细腻入心的服务.你想认识世界?世界已经认识你.'
啃哥张驰,gh_70ed9c34b2cb,http://www.iwgc.cn/list/5007,'关注于资本市场动态,尤其PE,VC投资的市场情况.发布最新投资成功失败案例,对资本市场动态进行自主独立分析,对经济事件给出自己的分析判断.穿插生活感悟与读书笔记.一切以原创为主,转发为辅,力求精品.宁可...'
产品中国,cpzgdlt,http://www.iwgc.cn/list/4835,'产品中国为大家提供高质量、精选、原创或翻译的干货文章;非常之多的职业经理人、程序猿、产品经理、设计湿、交互设计、大学生等互联网从业者都在这里等你来加入,成长源于文章!'
丁辰灵,ding_chenling,http://www.iwgc.cn/list/4829,'天使投资人,财富中文网,福布斯中文网,钛媒体,虎嗅网等专栏作家.互联网转型和新媒体专家,多家上市公司新媒体顾问,曾为联想,科通芯城,米其林,宝钢,中青旅,强生等培训互联网转型.连续创业者,阿母斯黛时...'
请不要害羞,haixiuzu1024,http://www.iwgc.cn/list/910,'豆瓣请不要害羞小组'
老苗撕营销,yiheyingxiao,http://www.iwgc.cn/list/7852,'营销学、广告学、经济学、行为学一锅烩,秘方、良方、偏方、伪方大揭底,阴谋阳谋妙计诡计集中营,营销江湖专业老鸟速成班.足尺足秤,童叟无欺.'
萍实广角,pengxiaolong68,http://www.iwgc.cn/list/6526,'精心挑选时下最经典,最有影响力的热门文章,打开尘封的历史,解读中国的现实,用不一样的思维开阔眼界,推吴楚文化,兴萍实之乡.'
知日,zhi_japan,http://www.iwgc.cn/list/1773,'致力为中国年轻人深度报道日本文化,技术,创意,艺术和旅行.'
洋葱新闻,weibobaozhi,http://www.iwgc.cn/list/1752,'微博每天产生海量的资讯,我们用专业的态度、娱乐的精神,为读者奉上最热门的游戏资讯.'
web前端开发,web007007,http://www.iwgc.cn/list/6855,'web前端的技术学习(html;css;js)每天进步一小步,人生进步一大步!'
北京银行长沙分行,CHANGSHABJ,http://www.iwgc.cn/list/9037,'享受有品位的财富生活,感受更贴心的金融服务.在这里,您能了解到第一手的个人理财资讯、贷款优惠政策、特惠商户活动、银行服务信息,以及最全面的贵宾客户活动.北京银行长沙分行将用“真诚所以信赖”的服务理念...'
北京银行长沙分行信用卡,CHANGSHABJ,http://www.iwgc.cn/list/9034,'爱生活,就用京行信用卡!'
北京银行南昌分行,bjyhnc,http://www.iwgc.cn/list/9032,'北京银行南昌分行欢迎您,我们将全心全意为您服务.'
杨红旭楼市研究,yhxlsyj,http://www.iwgc.cn/list/5234,'研究房地产市场,追踪数据是基本,构建逻辑是核心,探究规律是手段,预测未来是目标.而宏观经济、货币政策、地产调控、制度变化等只是外围因素.终极目标:研究成果影响并有益于市场主体.'
英语学习笔记,ericzenglish,http://www.iwgc.cn/list/2078,'Eric的英文学习笔记; all things considered:)'
绘本家居,huibenwang,http://www.iwgc.cn/list/8916,'【最专业的装修设计杂志】,每天分享装修美图,让您不再脑袋空空,绝对是您的装修设计必备灵感库,设计师的灵感宝典!'
睹图,aidutu,http://www.iwgc.cn/list/8915,'这里有文艺、态度,别样的视现.'
八妹咖啡时间,bameikafei,http://www.iwgc.cn/list/8913,'最有料的文艺特刊,最时尚的生活指南,能治剩女心中病,能减吃货腹上肉,每天一杯咖啡的时间,八妹和你聊聊女人最关心的那些事儿.'
世界华人周刊,wcweekly,http://www.iwgc.cn/list/8910,'全球视野,家国情怀,华人世界里可思、可乐、涨姿势的品牌文化读物.'
ExcelPPT哲么简单,TrainerZMZ,http://www.iwgc.cn/list/3195,'不一样的视角,全新的EXCEL/WORD/PPT技能讲解方式,让你和你的小伙伴们都惊呆了!让OFFICE不再是你的心病!让我们一起摆脱OFFICE带来的困扰!'
汽车爱好者,CarLike,http://www.iwgc.cn/list/8906,'国内知名汽车新媒体,汽车行业风向标,汽车爱好者的乐园.看车、玩车、用车,一切尽在汽车爱好者!'
汽车迷,Carfanss,http://www.iwgc.cn/list/8907,'关注汽车迷,获取最专业、最新、最够味的汽车资讯(酷车欣赏、新车点评、保养知识、驾驶技巧等).有趣、有料、有用,尽在汽车迷(iqcfans)!'
我是架构师,jiagoushi2015,http://www.iwgc.cn/list/8905,'经过多年的积淀,已有互联网、金融、电信、能源、制造等领域近千名架构师、CTO、开发人员通过本平台发布最前沿的技术,这里将有各位大牛的干货分享,相信人人都会有收获,人人都是架构师!'
中国银行青海分行,gh_385352ebe8be,http://www.iwgc.cn/list/8783,'随时掌握中国银行青海分行最新资讯,让您乐享移动金融生活!'
光大银行西安信用卡中心,xacebcard,http://www.iwgc.cn/list/8761,'光大银行信用卡西安地区官方微信公众平台~西安地区信用卡好吃、好喝、好玩、好优惠、好技巧的信息发布平台~特惠商户联盟加入的联系平台~光大惠行天下,阳光乐享生活!!'
互联网+,hlw0823,http://www.iwgc.cn/list/8482,'互联网+,决策者案头红宝书,腾讯官方出品'
建设银行黄石分行,CCB-HSJH,http://www.iwgc.cn/list/8823,'建设银行黄石市分行官方微信.24小时客户服务热线95533.'
建设银行无锡分行,ccbwx_dzyhb,http://www.iwgc.cn/list/8821,'中国建设银行无锡分行官方公众号'
建行衢州分行,ccb_qzjh,http://www.iwgc.cn/list/9111,'关注建行衢州分行电子银行,即时获取建行手机银行最新特惠商户,抢先体验最新服务.'
建行吉林分行电子银行,ccbjl_elutong,http://www.iwgc.cn/list/8846,'建行吉林分行电子银行(e路通)品牌宣传与产品服务'
宁波银行余姚支行,nbcb-yuyao,http://www.iwgc.cn/list/9071,'宁波银行余姚支行个人金融为您及时提供理财、贷款等相关产品资讯,更有贴近姚城的人文信息等您参与获取.'
内蒙建行电子银行,nmgqfhdzyh,http://www.iwgc.cn/list/8969,'金融知识、产品功能、操作指南、优惠活动、网购推荐.'
建设银行四川省分行,scccbebank,http://www.iwgc.cn/list/9137,'不一样的建设银行,给您最好的服务'
招商银行信用卡潍坊,weifang95555,http://www.iwgc.cn/list/9008,'欢迎关注招商银行信用卡潍坊卡部微信,即时获得最新最热门的优惠活动,抢先体验最新服务.“周三5折美食日”、“五折观影”、“五折欢唱”、“汽车加油返现”、“小积分大乐趣”,还有更多限时赠礼活动.信用卡-我...'
招商银行信用卡泉州,cmb-qz,http://www.iwgc.cn/list/9004,'掌上生活APP:5折起享美食、9积分享兑、10元起影院在线选座观影、汽车分期等;推荐办卡更有好礼相送!'
招商银行温州分行,wz-cmbchina,http://www.iwgc.cn/list/8997,'我们有最全面的招行动态,最新的招行咨询,吃喝玩乐,小招掌握,关注招行,乐享生活!'
网易每日轻松一刻,qingsong_163,http://www.iwgc.cn/list/5274,'推送每日轻松一刻栏目的最新消息,有福利有捡漏~'
招商银行信用卡-上海,cmbcc021,http://www.iwgc.cn/list/9006,'招商银行信用卡官微-上海,精选上海地区热门用卡优惠,超值积分兑换,周三5折享美食,周六5折看电影,iphone分期,汽车分期,招粉福利等,精彩纷呈,不容错过!'
招商银行海口分行,CMBHN95555,http://www.iwgc.cn/list/8989,'品牌宣传、公益服务等'
YOKA男士网,YOKAMENCOM,http://www.iwgc.cn/list/9169,'态度创造品位! YOKA男士网是YOKA时尚旗下为男性打造的国内最具影响力的精英男性品位网站,内容注重男士时尚、风格、时事,也包括了汽车、腕表、数码、性情、旅游和财经等方面.来这里,跟我们聊聊男人那点儿事.'
光大银行长沙分行信用卡,GD-card,http://www.iwgc.cn/list/8750,'光大银行长沙分行信用卡公共平台;第一时间为您发送最新的美食、娱乐资讯,诚邀您的参与.'
微荐,weixindigg,http://www.iwgc.cn/list/760,'有节操的转载,有良心的推荐.'
器宇轩昂,qiyuxuanang74,http://www.iwgc.cn/list/9168,'这里是男神的修炼地,是男子汉的训练营,这里为男性提供各种健身运动和塑身训练.为打造男神的社交礼仪、谈吐举止、穿衣搭配、时尚和品味提供指导.为真男人的城府、智慧和成功提供指导.'
招商银行衢州分行,cmb0570,http://www.iwgc.cn/list/8994,'招商银行衢州分行--即时获取最时尚最热门的优惠活动,抢先体验最潮最新的综合金融服务.爱生活,爱美食,爱理财,尽在你的招商银行,订阅我,改变你!'
固定收益投资,GDSY-TZ,http://www.iwgc.cn/list/9019,'固定收益类投资分析,宏观分析信息共享,债券市场研究,固定收益类产品推介.'
国家地理精选,gjdljx,http://www.iwgc.cn/list/150,'我们无法走遍世界上每壹个角落,但在这里可以发现更多的地球之美.'
招商银行信用卡-天津,TJ95555,http://www.iwgc.cn/list/9007,'欢迎关注招商银行信用卡天津卡部微信,即时获取最新最热门的优惠活动,抢先体验最新服务.“周三5折美食日”、“天天电影节”、“小积分大乐趣”、“分期购车”等活动缤纷,大牌云集,津城优惠活动抢先了解!我就...'
华夏银行微刊,hxbwfw,http://www.iwgc.cn/list/8898,'华夏银行微服务'
招商银行无锡分行,CMB_Wuxi,http://www.iwgc.cn/list/8998,'理财及其他产品推广、银行优惠活动介绍'
中国银行沈阳分行,bocshenyang,http://www.iwgc.cn/list/8787,'信息发布'
招商银行95555,CMB_DB95555,http://www.iwgc.cn/list/9151,'招商银行95555官方微信'
龙卡信用卡一宁波,ccbnbxyk,http://www.iwgc.cn/list/9141,'精彩活动,尽在“宁波建行信用卡”!'
别致非凡公司,biezhifeifantoupiao,http://www.iwgc.cn/list/9159,'别致非凡专业投票团队'
招商银行信用卡-广州,gzcmbchina,http://www.iwgc.cn/list/9002,'招商银行信用卡广州本地化服务号,为您提供【办卡、账单与办卡进度查询等一站式服务】以及精选广州本地美食优惠,超值观影与汽车分期等【吃喝玩乐购】全方位的【优惠资讯】信息,带您畅享智慧信用生活.'
招商银行信用卡-深圳,zsyh1806214011,http://www.iwgc.cn/list/9000,'招商银行深圳分行信用卡部官方微信.精选深圳地区用卡优惠,一切为您.'
招商银行信用卡福州,cmb_fz,http://www.iwgc.cn/list/9001,'欢迎关注招商银行信用卡福州卡部微信,缤纷生活,一卡尽享,“招商银行信用卡-福州”为您开启新型都市生活体验——招行STYLE.'
龙卡信用卡,jiningccbcreditcard,http://www.iwgc.cn/list/8967,'掌握更多龙卡资讯,享受最新活动优惠,体验最佳客户服务,创造最有价值信用卡.'
招商银行信用卡北京,bk95555,http://www.iwgc.cn/list/8999,'欢迎关注招商银行信用卡北京卡部微信~无论您在北京是否拥有一张招行信用卡,关注我就对了╮(╯▽╰)╭ 天天5折看电影/天天5折K歌/周三5折美食日/分期购物0息0手续费... 点我了解一个不一样的招行信用卡(*^__^*)'
招商银行唐山分行,ts_cmbchina,http://www.iwgc.cn/list/8996,'欢迎关注招商银行唐山分行,了解招商银行唐山分行的最新产品、活动资讯与服务信息.招商银行,因您而变,服务至上.'
建行北京分行E路通,ccbbj-elutong,http://www.iwgc.cn/list/8844,'建行北京分行电子银行官方微信平台.发布公告、营销活动、理财产品、各类优惠、业务介绍信息等.'
静怡学姐,izywll,http://www.iwgc.cn/list/9171,'静怡学姐帮你解答一切心事,关于男女心理,关于爱情事业,还有你想要了解的任何问题,只要提问,就有解答!'
别致非凡团队,biezhi168,http://www.iwgc.cn/list/9160,'别致非凡专业投票团队'
宠物帮领养中心,PetBang2014,http://www.iwgc.cn/list/9013,'宠物帮领养中心(公益组织),中国第一家全国性网络领养平台,我们倡导“以领养代替购买”,每日发布最新全国领养信息和宠物故事,每月举办“宠物帮网络领养日”,欢迎各位喜欢动物的爱心人士加入到我们当中. 您也...'
MedSci,MedSci_cn,http://www.iwgc.cn/list/9010,'梅斯医学(MedSci)是国内领先的医学科研与学术服务平台,致力于医疗质量的改进,为临床实践提供智慧、精准的决策支持,让医生与患者受益.'
招商银行信用卡杭州,cmb0571,http://www.iwgc.cn/list/9003,'精选杭州地区优惠活动:5折享美食、5折看电影、办卡送好礼、积分淘优惠、分期购车等,更多优惠尽在“掌上生活”APP.'
温州市图书馆,wzlibrary,http://www.iwgc.cn/list/9009,'温州市图书馆官方微信平台'
招商银行上海分行,cmbsh95555,http://www.iwgc.cn/list/8995,'招商银行上海分行生活消费金融信息平台'
招商银行佛山分行,cmbfoshan,http://www.iwgc.cn/list/8988,'惊喜无限 优惠无穷'
招商银行三明分行,cmb_sm,http://www.iwgc.cn/list/8985,'我们有最全面的招行动态,最新的理财资讯,一卡在手,吃喝玩乐!关注招行,乐享生活!'
天津招行金葵绽放,tj-cmbchina,http://www.iwgc.cn/list/8986,'我们有最全面的招行动态,最新的招行资讯,吃喝玩乐,一卡掌握,关注招行,乐享生活!'
DearMentor,DearMentor,http://www.iwgc.cn/list/9172,'Dear mentor,一个百万级融资的留学与求职P2P(Person-to-Person)线上咨询平台.由华尔街精英团队打造,连接你与1000+位梦想导师,覆盖50+个专业领域,全球200+所名校. 1000+导师,近在咫尺.'
别致非凡专业,biezhifeifanshuapiao,http://www.iwgc.cn/list/9161,'<!--red_beg-->别致非凡专业<!--red_end-->投票团队'
中国建设银行洛阳分行,ccb_ly,http://www.iwgc.cn/list/8977,'中国建设银行洛阳分行'
中国建设银行绍兴分行,SXCCB0575,http://www.iwgc.cn/list/8984,'品牌宣传、产品推广、企业文化、公益服务等'
招商银行南昌分行,cmbchina-NC,http://www.iwgc.cn/list/8992,'欢迎关注招商银行南昌分行,第一时间奉送最新鲜、最实用的活动资讯,助您打造最实惠的金融生活.'
中国建设银行广西区分行,gxccb95533,http://www.iwgc.cn/list/8982,'中国建设银行广西区分行公众服务平台.发布公告信息、理财产品信息、优惠活动信息,介绍建设银行产品及使用方法.'
上海建行,sh_ccb,http://www.iwgc.cn/list/8971,'随时掌握建行最新资讯,让您乐享生活!'
昆山建行,su_ks_ccb,http://www.iwgc.cn/list/8966,'中国建设银行昆山分行官方公众号'
周国平,zhouguoping6666,http://www.iwgc.cn/list/9175,'一、首发周国平的新作品或者其部分内容; 二、摘编周国平以前作品中的文字; 三、转载媒体或其他自媒体平台上对周国平的评论; 四、周国平与网友们互动,对评论和留言予以回应; 五、报道周国平的社会活动.'
大师兄小师妹,xxhh_dh2014,http://www.iwgc.cn/list/9174,'屌丝又无节操的大师兄和花痴还很逗比的小师妹,分分钟为您上演一出出无下限的搞笑闹剧.'
不读不快,a2839428978,http://www.iwgc.cn/list/9173,'每天推荐精彩正能量文章,有趣、有爱、有用'
建设银行萍乡市分行,px-ccb,http://www.iwgc.cn/list/8965,'随时掌握建行最新资讯,让您乐享生活!'
时尚江湖,fun_fashion,http://www.iwgc.cn/list/9179,'本账号为云思想旗下瘦马工作室与爱奇艺联合制作的周播节目——《时尚江湖》的衍生服务.内容包括:生活方式、两档视频节目及线下品位课活动.商务合作:Lily ;电话:010.85322201,邮箱:lilyliu@clouds100.cn'
老友记,itlaoyou-com,http://www.iwgc.cn/list/9177,'优酷网《老友记》节目官方微信互动平台'
临床药师网,clinphar2007,http://www.iwgc.cn/list/7336,'国内最大的临床药师学习交流平台.'
杏林口腔,xinglinkouqiang,http://www.iwgc.cn/list/9181,'华西口腔医学院口腔医学生的公众平台,主要用于学生信息的推送.'
LateNightWhisper深夜蜜语,latenightwhisper,http://www.iwgc.cn/list/9178,'和闺蜜畅谈女性私房话题,用新鲜视角讨论两性情感,打造新女性专属闺蜜圈.'
晓说,GaoXiaoSong-XS,http://www.iwgc.cn/list/9180,'大紧不在,《晓说》不死.本公众号目前由《晓说》动画人物(的配音)老王亲自打理,尽力为您奉上精彩、有见解的二手文章.每篇文章出处均可在“阅读原文”中找到.二手的文章,一手的态度!(您有喜欢的文章也欢迎...'
川哥,CG_romantic,http://www.iwgc.cn/list/9154,'和许川一起,改变,做更好的自己'
数字尾巴,shuzideweiba2156,http://www.iwgc.cn/list/9021,'“分享美好数字生活” 是数字尾巴一直所提倡并坚持的理念,囊括手机、平板、周边、摄影、旅行、生活、资讯等近二十多个系列内容,为热爱生活的朋友们提供了一个可以畅所欲言广结同好的平台,引领着喜爱数码科技的用...'
云也退,yunyetuitui,http://www.iwgc.cn/list/1684,'独立记者、文化专栏作家云也退的作品发布平台,独立专访、专栏、旅行记、阅读笔记、书评、译作、歌谣……一台被堵在二环的文字洒水车所做的一切.'
iiiidea,iiiidea,http://www.iwgc.cn/list/1146,'王左中右的“变态字”'
华夏银行常州分行,hxb_changzhou,http://www.iwgc.cn/list/8889,'推广华夏银行品牌,发布华夏银行常州分行各类最新活动及理财、新产品等资讯.'
交通银行信用卡武汉,pcccwuhan,http://www.iwgc.cn/list/8886,'交通银行信用卡武汉'
招商银行信用卡西安,CMB-XIAN,http://www.iwgc.cn/list/9025,'就算大雨让整座城市都颠倒,小招会给你怀抱~ 周三5折,用美食安慰心和胃;10元观影,好片子我们一起看~'
华夏银行重庆分行,hxyhcqfh,http://www.iwgc.cn/list/8890,'金融类服务'
男士学院,mencollege,http://www.iwgc.cn/list/4106,'做一个比你父亲还要优秀的男人.两性话题、健身护肤、搭配指南、生活知识、心灵鸡汤、时尚星座......在这里你会学到很多很多!'
中软国际,ICSSXA,http://www.iwgc.cn/list/8123,'传递中软国际与中国软件产业共成长的历程,分享公司与员工、客户等成功路上的酸甜苦辣,展现公司“追求卓越,勇于创新”的点滴动态,弘扬“奋斗为本,成就客户,创造分享,共同成长”的价值观.'
你丫才美工,Ymeigong,http://www.iwgc.cn/list/3924,'严格意义来讲,打水印和打码一样,都是下流的凑性.生活就是这样:希翼在上,护翼在下!'
复星昆仲资本,kinzoncapital,http://www.iwgc.cn/list/3024,'复星昆仲资本公众平台,新闻发布官方平台.'
思味,gh_264e49195217,http://www.iwgc.cn/list/5114,'由康奈尔大学食品科学系研究生运营,向大家推送专业健康的创意料理和详细科学的食品营养知识.'
混子曰,hey-stone,http://www.iwgc.cn/list/291,'是混子曰,不是混子日,也不是混日子,看我口型,跟我念,yue ,哎,对了,终于念对了,好了,可以关注了.'
meiya,sz_meiya,http://www.iwgc.cn/list/1046,'爱生活,爱成长,改变就趁现在,成长从心开始.meiya,畅销书作家,已出版《慢慢来,一切都来得及》《慢慢来,让灵魂跟上来》《 他爱的是玫瑰,而你是蔷薇》《你值得拥有最好的一切》等书.目前从事心理行业.创立...'
